[
  {
    "id": "alumni-2015-007",
    "name": "Ahmad Farhan Hafidzudin",
    "role": "Anggota",
    "batch": 2015,
    "consent": false,
    "currentPosition": "Backend",
    "contact": {
      "linkedin": "https://www.linkedin.com/in/ahmad-farhan-hapizhudin-914b60118/"
    },
    "achievements": []
  },
  {
    "id": "alumni-2015-006",
    "name": "Bagus Bayu Kencana",
    "role": "Anggota",
    "batch": 2015,
    "consent": false,
    "currentPosition": "Backend",
    "contact": {
      "linkedin": "https://www.linkedin.com/in/bagus-bayu-kencana-7b8a8411a/"
    },
    "achievements": []
  },
  {
    "id": "alumni-2015-010",
    "name": "Bowi Andreyano",
    "role": "Anggota",
    "batch": 2015,
    "consent": false,
    "currentPosition": "Entrepreneur",
    "contact": {
      "linkedin": "https://www.linkedin.com/in/bowiandreyano/"
    },
    "achievements": []
  },
  {
    "id": "alumni-2015-004",
    "name": "Buce Immanuel",
    "role": "Anggota",
    "batch": 2015,
    "consent": false,
    "currentPosition": "Backend",
    "contact": {
      "linkedin": "https://www.linkedin.com/in/buceimanuel/"
    },
    "achievements": []
  },
  {
    "id": "alumni-2015-005",
    "name": "David Wijaya",
    "role": "Anggota",
    "batch": 2015,
    "consent": false,
    "currentPosition": "Backend",
    "contact": {
      "linkedin": "https://www.linkedin.com/in/davidwijaya09/"
    },
    "achievements": []
  },
  {
    "id": "alumni-2015-013",
    "name": "Ginfa Ghifari Yahya",
    "role": "Anggota",
    "batch": 2015,
    "consent": false,
    "currentPosition": "Digital Marketing",
    "contact": {
      "linkedin": "https://www.linkedin.com/in/ginfa-ghifary/"
    },
    "achievements": []
  },
  {
    "id": "alumni-2015-001",
    "name": "Muhamad Hudya Ramadhana",
    "role": "Anggota",
    "batch": 2015,
    "consent": false,
    "currentPosition": "Backend",
    "contact": {
      "linkedin": "https://linkedin.com/in/perogeremmer"
    },
    "achievements": []
  },
  {
    "id": "alumni-2015-002",
    "name": "Mutia Ayu DIanita",
    "role": "Anggota",
    "batch": 2015,
    "consent": false,
    "currentPosition": "Frontend",
    "contact": {
      "linkedin": "https://www.linkedin.com/in/mutiadianita"
    },
    "achievements": []
  },
  {
    "id": "alumni-2015-012",
    "name": "Rahmawati Putri",
    "role": "Anggota",
    "batch": 2015,
    "consent": false,
    "currentPosition": "Quality Assurance",
    "contact": {
      "linkedin": "https://www.linkedin.com/in/rahmawati-putri-714b2812a/"
    },
    "achievements": []
  },
  {
    "id": "alumni-2015-009",
    "name": "Salma Shella",
    "role": "Anggota",
    "batch": 2015,
    "consent": false,
    "currentPosition": "IT Business Analyst",
    "contact": {
      "linkedin": "https://www.linkedin.com/in/salma-shella-b7397b128/"
    },
    "achievements": []
  },
  {
    "id": "alumni-2015-008",
    "name": "Siti Aisyah",
    "role": "Anggota",
    "batch": 2015,
    "consent": false,
    "currentPosition": "Product Management",
    "contact": {
      "linkedin": "https://www.linkedin.com/in/siti-aisyah-6b19b917b/"
    },
    "achievements": []
  },
  {
    "id": "alumni-2015-003",
    "name": "Tivo Yudha Perwira",
    "role": "Anggota",
    "batch": 2015,
    "consent": false,
    "currentPosition": "Lead Frontend Engineer",
    "contact": {
      "linkedin": "https://www.linkedin.com/in/tivo-yudha/"
    },
    "achievements": []
  },
  {
    "id": "alumni-2015-011",
    "name": "Zulfi Robbani",
    "role": "Anggota",
    "batch": 2015,
    "consent": false,
    "currentPosition": "Entrepreneur",
    "contact": {
      "linkedin": "https://www.linkedin.com/in/zulfirobbani/"
    },
    "achievements": []
  }
]