[
  {
    "id": "alumni-2024-002",
    "name": "Aidan Rabbihafiz Joe",
    "role": "Anggota",
    "batch": 2024,
    "consent": false,
    "contact": {
      "linkedin": "https://www.linkedin.com/in/aidan-rabbihafiz-joe/"
    },
    "achievements": []
  },
  {
    "id": "alumni-2024-003",
    "name": "Briant Abrar Antora",
    "role": "Anggota",
    "batch": 2024,
    "consent": false,
    "contact": {
      "linkedin": "https://www.linkedin.com/in/brianabrar"
    },
    "achievements": []
  },
  {
    "id": "alumni-2024-004",
    "name": "Khanza Haura",
    "role": "Anggota",
    "batch": 2024,
    "consent": false,
    "contact": {
      "linkedin": "https://www.linkedin.com/in/khanzahaura/"
    },
    "achievements": []
  },
  {
    "id": "alumni-2024-005",
    "name": "Muhammad Naufalnadi Putra Rasya",
    "role": "Anggota",
    "batch": 2024,
    "consent": false,
    "contact": {
      "linkedin": "https://www.linkedin.com/in/muhammad-naufalnadi/"
    },
    "achievements": []
  },
  {
    "id": "alumni-2024-006",
    "name": "Muhammad Radhwa Bagas Widyasa",
    "role": "Anggota",
    "batch": 2024,
    "consent": false,
    "contact": {
      "linkedin": "www.linkedin.com/in/bagaswidyasa"
    },
    "achievements": []
  },
  {
    "id": "alumni-2024-008",
    "name": "Muhammad Yanuar Andrianto Putra",
    "role": "Anggota",
    "batch": 2024,
    "consent": false,
    "contact": {
      "linkedin": "www.linkedin.com/in/muhammad-yanuar-andrianto-putra"
    },
    "achievements": []
  },
  {
    "id": "alumni-2024-007",
    "name": "Muhammad wali yudinnullah",
    "role": "Anggota",
    "batch": 2024,
    "consent": false,
    "contact": {
      "linkedin": "https://www.linkedin.com/in/wali-yudin-0b08a33b6"
    },
    "achievements": []
  },
  {
    "id": "alumni-2024-009",
    "name": "Naj’mira Rahmadina",
    "role": "Anggota",
    "batch": 2024,
    "consent": false,
    "contact": {
      "linkedin": "https://www.linkedin.com/in/najmirarahmadina"
    },
    "achievements": []
  },
  {
    "id": "alumni-2024-010",
    "name": "Namira Assalwa",
    "role": "Anggota",
    "batch": 2024,
    "consent": false,
    "contact": {
      "linkedin": "https://www.linkedin.com/in/namira-assalwa"
    },
    "achievements": []
  },
  {
    "id": "alumni-2024-011",
    "name": "Roysi Dewadipua Andryan Trilaksana Ruchwarsito",
    "role": "Anggota",
    "batch": 2024,
    "consent": false,
    "contact": {
      "linkedin": "https://www.linkedin.com/in/roysi-dewadipua-a-t-r-324781286/"
    },
    "achievements": []
  },
  {
    "id": "alumni-2024-012",
    "name": "Vany Putri Handayani",
    "role": "Anggota",
    "batch": 2024,
    "consent": false,
    "contact": {
      "linkedin": "https://www.linkedin.com/in/vanyputrihandayani/"
    },
    "achievements": []
  },
  {
    "id": "alumni-2024-001",
    "name": "Yazid Putra Muhammad Riziq",
    "role": "Anggota",
    "batch": 2024,
    "consent": false,
    "contact": {
      "linkedin": "https://www.linkedin.com/in/yazid-riziq"
    },
    "achievements": []
  },
  {
    "id": "alumni-2024-013",
    "name": "Zulfarida",
    "role": "Anggota",
    "batch": 2024,
    "consent": false,
    "contact": {
      "linkedin": "https://www.linkedin.com/in/zulfa-rida-685714322"
    },
    "achievements": []
  }
]