[
  {
    "id": "alumni-2021-006",
    "name": "Adhisti Roshandy",
    "role": "Anggota",
    "batch": 2021,
    "consent": false,
    "achievements": []
  },
  {
    "id": "alumni-2021-008",
    "name": "Ghina Fairuz Putri Warjono",
    "role": "Anggota",
    "batch": 2021,
    "consent": false,
    "achievements": []
  },
  {
    "id": "alumni-2021-007",
    "name": "Jason Iskandar Syakir",
    "role": "Anggota",
    "batch": 2021,
    "consent": false,
    "achievements": []
  },
  {
    "id": "alumni-2021-004",
    "name": "Karen Violanda Ginting",
    "role": "Anggota",
    "batch": 2021,
    "consent": false,
    "achievements": []
  },
  {
    "id": "alumni-2021-005",
    "name": "Nur Alfianti Ika Mawarni",
    "role": "Anggota",
    "batch": 2021,
    "consent": false,
    "achievements": []
  },
  {
    "id": "alumni-2021-001",
    "name": "Rafie Ananda Suhermawan",
    "role": "Anggota",
    "batch": 2021,
    "consent": false,
    "achievements": []
  },
  {
    "id": "alumni-2021-012",
    "name": "Raid Abdurrahman Ikram",
    "role": "Anggota",
    "batch": 2021,
    "consent": false,
    "achievements": []
  },
  {
    "id": "alumni-2021-010",
    "name": "Rizki Aswangga Adiluhur",
    "role": "Anggota",
    "batch": 2021,
    "consent": false,
    "achievements": []
  },
  {
    "id": "alumni-2021-011",
    "name": "Roger Martua Osman Simanjuntak",
    "role": "Anggota",
    "batch": 2021,
    "consent": false,
    "achievements": []
  },
  {
    "id": "alumni-2021-009",
    "name": "Saskia Oktavianasyah",
    "role": "Anggota",
    "batch": 2021,
    "consent": false,
    "achievements": []
  },
  {
    "id": "alumni-2021-003",
    "name": "Shidqa Shifiyna",
    "role": "Anggota",
    "batch": 2021,
    "consent": false,
    "achievements": []
  },
  {
    "id": "alumni-2021-013",
    "name": "Yusuf Budimansyah",
    "role": "Anggota",
    "batch": 2021,
    "consent": false,
    "achievements": []
  },
  {
    "id": "alumni-2021-002",
    "name": "Yusuf amin Abdillah",
    "role": "Anggota",
    "batch": 2021,
    "consent": false,
    "achievements": []
  }
]